Español	Shipibo-Konibo
Conoce qué es el coronavirus COVID-19	Onanwe jawerin nato Coronavirus COVID-19 ixon
¿Qué es el Coronavirus?	¿Jawerin Coronavirus?
Los coronavirus (CoV) son una amplia familia de virus que pueden causar diversas afecciones, desde el resfriado común, hasta infecciones respiratorias graves.  
Actualmente se investiga a un coronavirus surgido en la ciudad de Wuhan, China, al que se le ha denominado “Covid-19”.  
El 80% de los casos presentados en el mundo se presentan como una gripe normal y son fáciles de manejar, en tanto que el 20% puede hacer una complicación menor, de ellos un 10% necesita de hospitalización. 
¿De dónde proviene? 
Los primeros casos fueron reportados en la ciudad de Wuhan (China) que concentra más 90% de casos de esta enfermedad en el mundo. Actualmente se conocen casos en algunas zonas de Tailandia, Japón, Corea del Sur, Italia, España, Irak, Francia, Estados Unidos, México, Brasil, Ecuador, Chile, Perú, entre otros países.  
¿Cómo se transmite? 
Se transmite de persona a persona a través de gotitas que expulsa una persona enferma al hablar, toser o estornudar.  
Las gotitas pueden ser inhaladas por las personas que están cerca al enfermo y también quedarse en cualquier tipo de superficie (pasamanos, mesas, lapiceros, entre otros) y ser tocadas por las manos. 
El virus ingresa a nuestro organismo cuando nos tocamos los ojos, la nariz y la boca con las manos sin lavar. 
Dónde comunicarse para recibir atención 
Para mayor información, no dudes en llamarnos a la línea gratuita 113 desde cualquier operador de telefonía fija o móvil, escribirnos al WhatsApp 952842623 o al correo infosalud@minsa.gob.pe. Atendemos las 24 horas de los 365 días del año. 
Recomendaciones     
Lávate las manos frecuentemente, con agua y jabón, mínimo 20 segundos.  
Cúbrete la nariz y boca con el antebrazo o pañuelo desechable, al estornudar o toser. 
Evita tocarte las manos, los ojos, la nariz y la boca, con las manos sin lavar. 
Evita el contacto directo con personas con problemas respiratorios. 
Ante la presencia de síntomas leves (tos, dolor de garganta y fiebre), cúbrase al toser y lávese las manos. De ser posible permanezca en casa.  
Ante la presencia de síntomas severos (dificultad respiratoria y fiebre alta), comuníquese al 113.  
Evitar saludo de mano o beso en la mejilla. 
No auto medicarse.  
Bote a la basura los pañuelos desechables que haya utilizado. 
Mantenga limpias superficies de su casa, oficina o negocio (mesa, baños, pisos, juguetes, entre otros) pasando un trapo con desinfectante (por ejemplo, lejía). 
